[
  {
    "schemaVersion": "1.0.0",
    "workId": "work.the-legend-of-zelda",
    "canonicalTitle": "The Legend of Zelda",
    "aliases": [],
    "scopeDecision": "included",
    "inclusionBasis": "Included by the frozen Nintendo Zelda Portal HISTORY work-node rule; Oracle pair is resolved as two content-distinct works.",
    "releaseFamily": {
      "primaryVersionId": "version.the-legend-of-zelda.original",
      "versions": [
        {
          "versionId": "version.the-legend-of-zelda.original",
          "relationship": "original",
          "researchTreatment": "primary",
          "platforms": [
            "Family Computer Disk System"
          ],
          "releaseDate": "1986-02-21",
          "deltaFrom": null,
          "releaseWindow": null,
          "releaseEvents": [
            {
              "region": "JP",
              "date": "1986-02-21",
              "platform": "Family Computer Disk System",
              "distribution": "unknown"
            }
          ],
          "notes": "Date is the Japanese original catalogue date in the frozen Nintendo Zelda Portal HISTORY snapshot."
        }
      ]
    },
    "perspectiveTags": [
      "2d-topdown"
    ],
    "researchStatus": "covered",
    "dimensionCoverage": {
      "dimension.player-fantasy": "covered",
      "dimension.core-loop": "covered",
      "dimension.verbs": "covered",
      "dimension.world-state": "covered",
      "dimension.topology": "covered",
      "dimension.gating-revisit": "covered",
      "dimension.puzzle-information": "covered",
      "dimension.dungeon-structure": "covered",
      "dimension.exploration-reward": "covered",
      "dimension.growth-economy": "covered",
      "dimension.combat-boss": "covered",
      "dimension.npc-quest": "covered",
      "dimension.narrative-performance": "covered",
      "dimension.camera-blocking": "covered",
      "dimension.teaching-feedback": "covered",
      "dimension.ui-input": "covered",
      "dimension.recovery-accessibility": "covered",
      "dimension.perspective-implementation": "covered",
      "dimension.hardware-multiplayer": "covered",
      "dimension.production-runtime": "covered"
    },
    "sourceRefs": [
      "source.nintendo.zelda-portal-history-en-20260717",
      "source.game.the-legend-of-zelda"
    ],
    "openQuestions": [],
    "lastReviewedAt": "2026-07-17"
  },
  {
    "schemaVersion": "1.0.0",
    "workId": "work.zelda-ii-the-adventure-of-link",
    "canonicalTitle": "Zelda II: The Adventure of Link",
    "aliases": [],
    "scopeDecision": "included",
    "inclusionBasis": "Included by the frozen Nintendo Zelda Portal HISTORY work-node rule; Oracle pair is resolved as two content-distinct works.",
    "releaseFamily": {
      "primaryVersionId": "version.zelda-ii-the-adventure-of-link.original",
      "versions": [
        {
          "versionId": "version.zelda-ii-the-adventure-of-link.original",
          "relationship": "original",
          "researchTreatment": "primary",
          "platforms": [
            "Family Computer Disk System"
          ],
          "releaseDate": "1987-01-14",
          "deltaFrom": null,
          "releaseWindow": null,
          "releaseEvents": [
            {
              "region": "JP",
              "date": "1987-01-14",
              "platform": "Family Computer Disk System",
              "distribution": "unknown"
            }
          ],
          "notes": "Date is the Japanese original catalogue date in the frozen Nintendo Zelda Portal HISTORY snapshot."
        }
      ]
    },
    "perspectiveTags": [
      "2d-topdown",
      "2d-sideview",
      "mixed"
    ],
    "researchStatus": "covered",
    "dimensionCoverage": {
      "dimension.player-fantasy": "covered",
      "dimension.core-loop": "covered",
      "dimension.verbs": "covered",
      "dimension.world-state": "covered",
      "dimension.topology": "covered",
      "dimension.gating-revisit": "covered",
      "dimension.puzzle-information": "covered",
      "dimension.dungeon-structure": "covered",
      "dimension.exploration-reward": "covered",
      "dimension.growth-economy": "covered",
      "dimension.combat-boss": "covered",
      "dimension.npc-quest": "covered",
      "dimension.narrative-performance": "covered",
      "dimension.camera-blocking": "covered",
      "dimension.teaching-feedback": "covered",
      "dimension.ui-input": "covered",
      "dimension.recovery-accessibility": "covered",
      "dimension.perspective-implementation": "covered",
      "dimension.hardware-multiplayer": "covered",
      "dimension.production-runtime": "covered"
    },
    "sourceRefs": [
      "source.nintendo.zelda-portal-history-en-20260717",
      "source.game.zelda-ii-the-adventure-of-link"
    ],
    "openQuestions": [],
    "lastReviewedAt": "2026-07-17"
  },
  {
    "schemaVersion": "1.0.0",
    "workId": "work.a-link-to-the-past",
    "canonicalTitle": "A Link to the Past",
    "aliases": [],
    "scopeDecision": "included",
    "inclusionBasis": "Included by the frozen Nintendo Zelda Portal HISTORY work-node rule; Oracle pair is resolved as two content-distinct works.",
    "releaseFamily": {
      "primaryVersionId": "version.a-link-to-the-past.original",
      "versions": [
        {
          "versionId": "version.a-link-to-the-past.original",
          "relationship": "original",
          "researchTreatment": "primary",
          "platforms": [
            "Super Famicom"
          ],
          "releaseDate": "1991-11-21",
          "deltaFrom": null,
          "releaseWindow": null,
          "releaseEvents": [
            {
              "region": "JP",
              "date": "1991-11-21",
              "platform": "Super Famicom",
              "distribution": "unknown"
            }
          ],
          "notes": "Date is the Japanese original catalogue date in the frozen Nintendo Zelda Portal HISTORY snapshot."
        }
      ]
    },
    "perspectiveTags": [
      "2d-topdown"
    ],
    "researchStatus": "covered",
    "dimensionCoverage": {
      "dimension.player-fantasy": "covered",
      "dimension.core-loop": "covered",
      "dimension.verbs": "covered",
      "dimension.world-state": "covered",
      "dimension.topology": "covered",
      "dimension.gating-revisit": "covered",
      "dimension.puzzle-information": "covered",
      "dimension.dungeon-structure": "covered",
      "dimension.exploration-reward": "covered",
      "dimension.growth-economy": "covered",
      "dimension.combat-boss": "covered",
      "dimension.npc-quest": "covered",
      "dimension.narrative-performance": "covered",
      "dimension.camera-blocking": "covered",
      "dimension.teaching-feedback": "covered",
      "dimension.ui-input": "covered",
      "dimension.recovery-accessibility": "covered",
      "dimension.perspective-implementation": "covered",
      "dimension.hardware-multiplayer": "covered",
      "dimension.production-runtime": "covered"
    },
    "sourceRefs": [
      "source.nintendo.zelda-portal-history-en-20260717",
      "source.game.a-link-to-the-past"
    ],
    "openQuestions": [],
    "lastReviewedAt": "2026-07-17"
  },
  {
    "schemaVersion": "1.0.0",
    "workId": "work.links-awakening",
    "canonicalTitle": "Link’s Awakening",
    "aliases": [],
    "scopeDecision": "included",
    "inclusionBasis": "Included by the frozen Nintendo Zelda Portal HISTORY work-node rule; Oracle pair is resolved as two content-distinct works.",
    "releaseFamily": {
      "primaryVersionId": "version.links-awakening.original",
      "versions": [
        {
          "versionId": "version.links-awakening.original",
          "relationship": "original",
          "researchTreatment": "primary",
          "platforms": [
            "Game Boy"
          ],
          "releaseDate": "1993-06-06",
          "deltaFrom": null,
          "releaseWindow": null,
          "releaseEvents": [
            {
              "region": "JP",
              "date": "1993-06-06",
              "platform": "Game Boy",
              "distribution": "unknown"
            }
          ],
          "notes": "Date is the Japanese original catalogue date in the frozen Nintendo Zelda Portal HISTORY snapshot."
        }
      ]
    },
    "perspectiveTags": [
      "2d-topdown",
      "2d-sideview",
      "mixed"
    ],
    "researchStatus": "covered",
    "dimensionCoverage": {
      "dimension.player-fantasy": "covered",
      "dimension.core-loop": "covered",
      "dimension.verbs": "covered",
      "dimension.world-state": "covered",
      "dimension.topology": "covered",
      "dimension.gating-revisit": "covered",
      "dimension.puzzle-information": "covered",
      "dimension.dungeon-structure": "covered",
      "dimension.exploration-reward": "covered",
      "dimension.growth-economy": "covered",
      "dimension.combat-boss": "covered",
      "dimension.npc-quest": "covered",
      "dimension.narrative-performance": "covered",
      "dimension.camera-blocking": "covered",
      "dimension.teaching-feedback": "covered",
      "dimension.ui-input": "covered",
      "dimension.recovery-accessibility": "covered",
      "dimension.perspective-implementation": "covered",
      "dimension.hardware-multiplayer": "covered",
      "dimension.production-runtime": "covered"
    },
    "sourceRefs": [
      "source.nintendo.zelda-portal-history-en-20260717",
      "source.game.links-awakening"
    ],
    "openQuestions": [],
    "lastReviewedAt": "2026-07-17"
  },
  {
    "schemaVersion": "1.0.0",
    "workId": "work.ocarina-of-time",
    "canonicalTitle": "Ocarina of Time",
    "aliases": [],
    "scopeDecision": "included",
    "inclusionBasis": "Included by the frozen Nintendo Zelda Portal HISTORY work-node rule; Oracle pair is resolved as two content-distinct works.",
    "releaseFamily": {
      "primaryVersionId": "version.ocarina-of-time.original",
      "versions": [
        {
          "versionId": "version.ocarina-of-time.original",